{
  "$schema": "https://json-schema.org/draft/2020-12/schema",
  "$id": "https://exam-oracle.local/contracts/prediction.schema.json",
  "title": "Exam Oracle sealed prediction",
  "description": "Written by B's rank_and_seal.py, rendered by C's dashboard and reveal. The SHA-256 seal is computed over the canonical JSON of THIS object (json.dumps(obj, sort_keys=True, separators=(',', ':'), ensure_ascii=False).encode('utf-8')). The hash is stored next to the file (<run_id>.sha256) and in the ledger, never inside the object.",
  "type": "object",
  "additionalProperties": false,
  "required": ["schema_version", "run_id", "course", "target_exam", "feature_set", "made_at", "lessons_run_seq", "k", "topics", "baselines", "weights"],
  "properties": {
    "schema_version": { "const": 1 },
    "run_id": { "type": "string", "pattern": "^r[0-9]+-.+$" },
    "course": { "type": "string" },
    "target_exam": { "type": "string", "description": "exam_id, e.g. 6.003-final-2011F" },
    "feature_set": { "enum": ["full", "exam_history"] },
    "cold_start": { "type": "boolean", "default": false },
    "made_at": { "type": "string", "description": "ISO-8601 timestamp with UTC offset" },
    "lessons_run_seq": { "type": ["integer", "null"], "description": "Lessons version used; null = cold-start weights" },
    "k": { "type": "integer", "minimum": 1 },
    "weights": {
      "type": "object",
      "description": "The beta weights used for this prediction (the lessons)",
      "additionalProperties": false,
      "required": ["intercept", "x1", "x2", "x3", "x4", "x5", "x6", "x7"],
      "properties": {
        "intercept": { "type": "number" },
        "x1": { "type": "number" }, "x2": { "type": "number" }, "x3": { "type": "number" }, "x4": { "type": "number" },
        "x5": { "type": "number" }, "x6": { "type": "number" }, "x7": { "type": "number" }
      }
    },
    "topics": {
      "type": "array",
      "minItems": 1,
      "description": "Every topic in the course's fixed list, sorted by rank ascending",
      "items": {
        "type": "object",
        "additionalProperties": false,
        "required": ["topic_id", "topic", "p", "rank", "in_top_k", "signals"],
        "properties": {
          "topic_id": { "type": "string" },
          "topic": { "type": "string" },
          "p": { "type": "number", "minimum": 0, "maximum": 1 },
          "rank": { "type": "integer", "minimum": 1 },
          "in_top_k": { "type": "boolean" },
          "signals": {
            "type": "object",
            "additionalProperties": false,
            "required": ["x1", "x2", "x3", "x4", "x5", "x6", "x7"],
            "properties": {
              "x1": { "type": "number" }, "x2": { "type": "number" }, "x3": { "type": "number" }, "x4": { "type": "number" },
              "x5": { "type": "number" }, "x6": { "type": "number" }, "x7": { "type": "number" }
            }
          }
        }
      }
    },
    "baselines": {
      "type": "object",
      "additionalProperties": false,
      "required": ["even", "last_exam"],
      "properties": {
        "even": { "type": "array", "items": { "type": "string" }, "description": "topic_ids chosen by baseline A (study evenly); empty when lecture data is not visible (exam_history runs use the closed-form expectation k/N at scoring)" },
        "last_exam": { "type": "array", "items": { "type": "string" }, "description": "topic_ids chosen by baseline B (copy last exam)" }
      }
    }
  }
}
